id,user_name,email,password,profile_picture,bio,created_at
1,alex1,alex1@gmail.com,YpDQcUOQ7X,profile1.jpg,"Adventure seeker, always on the move.",2/2/2024 10:15
2,jane2,jane2@outlook.com,bZgf4aFlVS,profile2.jpg,Tech enthusiast and coffee lover.,2/3/2024 10:15
3,michael3,michael3@hotmail.com,jqPlROSffg,profile3.jpg,Foodie exploring new cuisines every week.,2/4/2024 10:15
4,lisa4,lisa4@hotmail.com,roKolOqGij,profile4.jpg,"Aspiring artist, capturing moments through sketches.",2/5/2024 10:15
5,david5,david5@hotmail.com,SPgja5fmSb,profile5.jpg,"Fitness freak, gym is my second home.",2/6/2024 10:15
6,sara6,sara6@gmail.com,ko3KBogVE6,profile6.jpg,"Nature lover, hiking is my therapy.",2/7/2024 10:15
7,johnny7,johnny7@hotmail.com,eMpBpa9qIK,profile7.jpg,"Music addict, headphones on, world off.",2/8/2024 10:15
8,kevin8,kevin8@outlook.com,xKNx8hNyGL,profile8.jpg,"Gamer at heart, coding by profession.",2/9/2024 10:15
9,emily9,emily9@hotmail.com,XV2H0bnYUB,profile9.jpg,"Photography enthusiast, chasing golden hour.",2/10/2024 10:15
10,chris10,chris10@yahoo.com,Wv1U8R5CzL,profile10.jpg,"Bookworm, lost in fictional worlds.",2/11/2024 10:15
11,sophie11,sophie11@hotmail.com,7LWBm2XEmd,profile11.jpg,"Startup dreamer, building the next big thing.",2/12/2024 10:15
12,max12,max12@hotmail.com,HIhDDL76oF,profile12.jpg,"Travel junkie, collecting memories worldwide.",2/13/2024 10:15
13,anna13,anna13@outlook.com,dgblrllnh0,profile13.jpg,Love playing guitar and jamming sessions.,2/14/2024 10:15
14,peter14,peter14@outlook.com,loteZdAfVq,profile14.jpg,"Fitness coach, helping people stay healthy.",2/15/2024 10:15
15,oliver15,oliver15@outlook.com,q90pXtIE1y,profile15.jpg,"Stand-up comedian, making people laugh.",2/16/2024 10:15
16,zoe16,zoe16@gmail.com,BFVGHYeBJv,profile16.jpg,"Basketball player, hoop dreams all day.",2/17/2024 10:15
17,ethan17,ethan17@gmail.com,6QEOVjHpRY,profile17.jpg,"Fashion designer, creating trends.",2/18/2024 10:15
18,lucas18,lucas18@outlook.com,i99JrK6bil,profile18.jpg,"Animal lover, volunteer at pet shelters.",2/19/2024 10:15
19,mia19,mia19@yahoo.com,zcIvMp7Unq,profile19.jpg,"Sci-fi movie buff, space fascinates me.",2/20/2024 10:15
20,nathan20,nathan20@gmail.com,oGGqxAlZO5,profile20.jpg,"Stock trader, investing one trade at a time.",2/21/2024 10:15
21,sandra21,sandra21@outlook.com,AWCqTtnEFl,profile21.jpg,"Self-taught chef, experimenting in the kitchen.",2/22/2024 10:15
22,mark22,mark22@hotmail.com,xMBakW4hbV,profile22.jpg,"Podcaster, sharing stories that matter.",2/23/2024 10:15
23,lily23,lily23@hotmail.com,qPFCLl5PCR,profile23.jpg,"Yoga practitioner, staying balanced in life.",2/24/2024 10:15
24,paul24,paul24@outlook.com,LaI3rivuAB,profile24.jpg,"Street photographer, capturing raw emotions.",2/25/2024 10:15
25,jessica25,jessica25@hotmail.com,Y6mpHoHY4M,profile25.jpg,"Astrophysics student, obsessed with the universe.",2/26/2024 10:15
26,ryan26,ryan26@hotmail.com,T6hCHbWdZG,profile26.jpg,"Coffee connoisseur, brewing happiness.",2/27/2024 10:15
27,victor27,victor27@yahoo.com,EQ5r3MtW9Z,profile27.jpg,"Eco-warrior, advocating sustainable living.",2/28/2024 10:15
28,ella28,ella28@outlook.com,z40TQcpPvG,profile28.jpg,"History nerd, fascinated by ancient cultures.",2/1/2024 10:15
29,daniel29,daniel29@hotmail.com,U46kCmZnyX,profile29.jpg,"Aspiring filmmaker, storytelling through visuals.",2/2/2024 10:15
30,grace30,grace30@hotmail.com,uoTuMmruoc,profile30.jpg,"Car enthusiast, speed thrills.",2/3/2024 10:15
31,henry31,henry31@yahoo.com,W5H7NPsKCW,profile31.jpg,"Poet, writing words straight from the heart.",2/4/2024 10:15
32,olivia32,olivia32@hotmail.com,b1wseZEhqK,profile32.jpg,"AI researcher, building the future.",2/5/2024 10:15
33,noah33,noah33@yahoo.com,xw4058UOx0,profile33.jpg,"Cricket fan, never missing a match.",2/6/2024 10:15
34,ava34,ava34@outlook.com,mnByIOVdmT,profile34.jpg,"Horror movie lover, thrill-seeker.",2/7/2024 10:15
35,william35,william35@hotmail.com,ocn4KbH7D5,profile35.jpg,"Dog parent, my pup is my world.",2/8/2024 10:15
36,emma36,emma36@outlook.com,nC9tWoVcBK,profile36.jpg,"Street dancer, love expressing through movement.",2/9/2024 10:15
37,james37,james37@hotmail.com,BieG2S1wkR,profile37.jpg,"Minimalist, less is always more.",2/10/2024 10:15
38,isabella38,isabella38@gmail.com,nQFH9rxwmE,profile38.jpg,"Mountain climber, chasing peaks.",2/11/2024 10:15
39,benjamin39,benjamin39@gmail.com,SrYw067UsI,profile39.jpg,"Chess master, thinking five moves ahead.",2/12/2024 10:15
40,charlotte40,charlotte40@hotmail.com,sLWilYzz6I,profile40.jpg,"Software developer, coding my dreams.",2/13/2024 10:15
41,jacob41,jacob41@yahoo.com,5xQkHBPS08,profile41.jpg,"Tea lover, sipping peace every morning.",2/14/2024 10:15
42,amelia42,amelia42@yahoo.com,vs3ajKHPZc,profile42.jpg,"Magician, keeping secrets behind illusions.",2/15/2024 10:15
43,logan43,logan43@hotmail.com,PxhIQ4UsQZ,profile43.jpg,"Fashion influencer, redefining style.",2/16/2024 10:15
44,harper44,harper44@outlook.com,yf2XfjqISU,profile44.jpg,"Social activist, raising my voice.",2/17/2024 10:15
45,mason45,mason45@outlook.com,GThu3zj7Zf,profile45.jpg,"Classic rock fan, Rolling Stones forever.",2/18/2024 10:15
46,evelyn46,evelyn46@hotmail.com,BESxTrQypb,profile46.jpg,"Wine enthusiast, learning the art of tasting.",2/19/2024 10:15
47,elijah47,elijah47@gmail.com,N0gMmLiYCd,profile47.jpg,"Psychology student, understanding minds.",2/20/2024 10:15
48,abigail48,abigail48@hotmail.com,YjxRXwcjl4,profile48.jpg,Love writing blogs about tech and life.,2/21/2024 10:15
49,aiden49,aiden49@yahoo.com,F4agY6lAWm,profile49.jpg,"Marine biologist, passionate about ocean life.",2/22/2024 10:15
50,sowndhu50,sowndhu50@yahoo.com,mbQaKqwkRJ,profile50.jpg,"AI ethics advocate, responsible tech matters.",2/23/2024 10:15
51,alex51,alex51@yahoo.com,IMX8WJUBpa,profile51.jpg,"Football fan, loyal to my club.",2/24/2024 10:15
52,jane52,jane52@gmail.com,VXXJvhM9XO,profile52.jpg,"Street artist, graffiti is my language.",2/25/2024 10:15
53,michael53,michael53@outlook.com,ayt9XZ30kQ,profile53.jpg,"Entrepreneur, building businesses from scratch.",2/26/2024 10:15
54,lisa54,lisa54@hotmail.com,j0iBsdhr0S,profile54.jpg,"Karaoke king, singing my heart out.",2/27/2024 10:15
55,david55,david55@outlook.com,gdByiynK8W,profile55.jpg,"Astronomy geek, looking at the stars.",2/28/2024 10:15
56,sara56,sara56@hotmail.com,0sShpL4e0t,profile56.jpg,"DIY creator, making new crafts every day.",2/1/2024 10:15
57,johnny57,johnny57@hotmail.com,ptuRIW5uUo,profile57.jpg,"Mathematician, solving the universe’s puzzles.",2/2/2024 10:15
58,kevin58,kevin58@outlook.com,fn9Ug9JeMx,profile58.jpg,"Cybersecurity expert, making the web safe.",2/3/2024 10:15
59,emily59,emily59@yahoo.com,ojKYe8K4cC,profile59.jpg,"Dancer, choreographing my dreams into motion.",2/4/2024 10:15
60,chris60,chris60@hotmail.com,fW7jJicdX2,profile60.jpg,Custom bio for user 60,2/5/2024 10:15
